{"version":1,"type":"connect.enroll","sessionId":"s_fixture0001","sequence":1,"sentAt":"2026-10-16T08:30:00.000Z","payload":{"clientDeviceId":"da96726356de5002c857434beefe468d","createdAt":"2026-10-16T08:30:05.000Z","clientSignature":"MEYCIQC8X7tiyG46_kA4j1O7PZwJ80rcZsfmh-D_7qEgnXuNeAIhAMUTwRUyGiiStVi3vmHmenbX3_ZJLaR3wsng6UmjJCZh"}}
