{"version":1,"type":"notes.index","sessionId":"s_fixture0001","sequence":1,"sentAt":"2026-10-16T08:30:00.000Z","payload":{"notes":[{"id":"6f1c2b9e-1d2a-4c7e-9a51-3b8f0d2e4a10","updatedAt":"2026-10-16T08:30:00.000Z","deleted":false},{"id":"0b7e9a44-5c21-4f0e-8d9b-7a6c5e4d3b21","updatedAt":"2026-10-16T08:30:00.000Z","deleted":true}]}}
