{"version":1,"type":"clipboard.offer","sessionId":"s_fixture0001","sequence":1,"sentAt":"2026-10-16T08:30:00.000Z","payload":{"revisionId":"0b7e9a44-5c21-4f0e-8d9b-7a6c5e4d3b21","originDeviceId":"da96726356de5002c857434beefe468d","contentHash":"9f86d081884c7d659a2feaa0c55ad015a3bf4f1b2b0b822cd15d6c15b0f00a08","size":4,"mime":"text/plain"}}
