{"version":1,"type":"notification.posted","sessionId":"s_fixture0001","sequence":1,"sentAt":"2026-10-16T08:30:00.000Z","payload":{"notificationId":"n_3f2a9c","appPackage":"com.whatsapp","appLabel":"WhatsApp","title":"Asha","postedAt":"2026-10-16T08:30:00.000Z","redaction":"title_only","category":"msg"}}
