{"version":1,"type":"session.approved","sessionId":"s_fixture0001","sequence":1,"sentAt":"2026-10-16T08:30:00.000Z","payload":{"grantedCapabilities":["ai.chat","ai.agent"],"protocolVersion":1,"features":[],"heartbeatIntervalMs":5000,"agentWorkspaces":[{"workspaceId":"ws_7f3a","name":"my buddy"}],"agents":[{"kind":"claude_code","ready":true},{"kind":"codex","ready":false}]},"replyTo":1}
